{
  "schema": "notes.v2",
  "video_id": "python_l1",
  "update_index": 0,
  "media_start": 0.0,
  "media_end": 90.0,
  "window_starts": [
    1792051200000,
    1792051230000,
    1792051260000
  ],
  "section": {
    "id": 1,
    "title": "Part 1",
    "is_new": true
  },
  "points": [
    {
      "section_id": 1,
      "text": "So today we're going to talk a little bit about what is computation.",
      "t": 80.0,
      "kind": "point",
      "quote": "So today we're going to talk a little bit about what is computation."
    }
  ],
  "terms": [],
  "generator": "extractive",
  "model": null,
  "agent_ms": 2.1,
  "quality_flags": [],
  "session_start": 1792051200000,
  "created_ts": 1792051672000
}
