{
  "schema": "notes.v2",
  "video_id": "python_l1",
  "update_index": 0,
  "media_start": 360.0,
  "media_end": 450.0,
  "window_starts": [
    1792051560000,
    1792051590000,
    1792051620000
  ],
  "section": {
    "id": 1,
    "title": "Introduction",
    "is_new": true
  },
  "points": [],
  "terms": [],
  "generator": "llm",
  "model": "openai/gpt-oss-120b",
  "agent_ms": 1063.0,
  "quality_flags": [
    "dropped_low_support(0.18)"
  ],
  "session_start": 1792051200000,
  "created_ts": 1792051672000
}
